[
  {
    "company_name": "",
    "website": "",
    "industry": "",
    "hq_location": "",
    "team_size": "",
    "hiring_signals": [],
    "decision_makers": [
      {
        "full_name": "",
        "role": "",
        "email": "",
        "linkedin_url": ""
      }
    ],
    "pain_points": []
  }
]